{
  "schema_version": "gate3.effect_graph.v0.3",
  "tx_id": "tx_20260515022542_p9cc5o",
  "nodes": [
    {
      "id": "cmd_tx_20260515022542_p9cc5o",
      "type": "command.executed",
      "target": "ls \"D:/exp_all/AgentTX/data/v_0.3-alpha/deepseek-phase4-20260515_101933/workspaces/03_package_modify/.agenttx/transactions/tx_20260515022533_q0tcc8/\"",
      "status": "completed",
      "evidence": {
        "source": "request.json",
        "cwd": "D:\\exp_all\\AgentTX\\data\\v_0.3-alpha\\deepseek-phase4-20260515_101933\\workspaces\\03_package_modify",
        "tool_name": "Bash",
        "host": "claude-code"
      }
    }
  ],
  "edges": [],
  "note": "Gate 3 builds causal, dependency, belief-taint, and recovery-requirement edges from typed effects.",
  "updated_at": "2026-05-15T02:25:44.617Z"
}
