{
  "schema_version": "gate3.effect_graph.v0.3",
  "tx_id": "tx_20260515022724_s4n4lk",
  "nodes": [
    {
      "id": "cmd_tx_20260515022724_s4n4lk",
      "type": "command.executed",
      "target": "test -f package.json && echo \"EXISTS\" || echo \"DELETED\"",
      "status": "completed",
      "evidence": {
        "source": "request.json",
        "cwd": "D:\\exp_all\\AgentTX\\data\\v_0.3-alpha\\deepseek-phase4-20260515_101933\\workspaces\\04_file_delete",
        "tool_name": "Bash",
        "host": "claude-code"
      }
    }
  ],
  "edges": [],
  "note": "Gate 3 builds causal, dependency, belief-taint, and recovery-requirement edges from typed effects.",
  "updated_at": "2026-05-15T02:27:36.624Z"
}
